{"schemaVersion":"1.1.0","roomId":"a91b2623-95b1-4adc-8b69-4b09e8255454","boundary":[{"x":0,"y":320},{"x":0,"y":2160},{"x":1255,"y":2160},{"x":1255,"y":1840},{"x":4105,"y":1840},{"x":4105,"y":0},{"x":2515,"y":0},{"x":2515,"y":610},{"x":1900,"y":610},{"x":1900,"y":0},{"x":260,"y":0},{"x":260,"y":320}],"walls":[{"startPoint":{"x":0,"y":320},"endPoint":{"x":0,"y":2160},"thickness":200,"type":"partition"},{"startPoint":{"x":0,"y":2160},"endPoint":{"x":1255,"y":2160},"thickness":200,"type":"partition"},{"startPoint":{"x":1255,"y":2160},"endPoint":{"x":1255,"y":1840},"thickness":200,"type":"partition"},{"startPoint":{"x":1255,"y":1840},"endPoint":{"x":4105,"y":1840},"thickness":200,"type":"partition"},{"startPoint":{"x":4105,"y":1840},"endPoint":{"x":4105,"y":0},"thickness":200,"type":"partition"},{"startPoint":{"x":4105,"y":0},"endPoint":{"x":2515,"y":0},"thickness":200,"type":"partition"},{"startPoint":{"x":2515,"y":0},"endPoint":{"x":2515,"y":610},"thickness":200,"type":"partition"},{"startPoint":{"x":2515,"y":610},"endPoint":{"x":1900,"y":610},"thickness":200,"type":"partition"},{"startPoint":{"x":1900,"y":610},"endPoint":{"x":1900,"y":0},"thickness":200,"type":"partition"},{"startPoint":{"x":1900,"y":0},"endPoint":{"x":260,"y":0},"thickness":200,"type":"partition"},{"startPoint":{"x":260,"y":0},"endPoint":{"x":260,"y":320},"thickness":200,"type":"partition"},{"startPoint":{"x":260,"y":320},"endPoint":{"x":0,"y":320},"thickness":200,"type":"partition"}],"openings":[{"openingId":"f3f9dada-4fa4-5e43-acdb-c37b3960fd4a","wallIndex":1,"position":{"x":800,"y":2160},"width":800,"height":2055,"type":"door","swingDirection":"none","swingOpening":"inward"}],"drainagePoints":[{"drainId":"18cf2bb7-6115-587c-93b0-84cea66a5cfc","position":{"x":614,"y":172},"type":"wall_drain","diameter":40},{"drainId":"5869ea95-ea0a-5688-b66e-71a49fe2b4df","position":{"x":3775,"y":276},"type":"floor_drain","diameter":75},{"drainId":"b512c78f-a9d1-5796-97cf-acf0a47ce9f1","position":{"x":1283,"y":299},"type":"floor_drain","diameter":75},{"drainId":"259e3af4-a7ad-51b6-9f37-80d403aa43d7","position":{"x":3596,"y":1455},"type":"toilet_drain","diameter":110},{"drainId":"c8e185e8-5a46-577a-8f18-4b883c407da4","position":{"x":3596,"y":1455},"type":"toilet_drain","diameter":380}],"pipeEnclosures":[],"waterSupplyPoints":[{"supplyId":"92bdcd82-5b3d-54dd-9116-47d586a42e80","position":{"x":3596,"y":1455},"waterType":"mixed","heightAboveFloor":760}],"measurementPoints":[{"pointId":"point-1","kind":"drain","label":"drain","position":{"x":614,"y":172},"width":40,"depth":40,"height":10,"rotation":0},{"pointId":"point-2","kind":"floor_drain","label":"淋浴地漏","position":{"x":3775,"y":276},"width":75,"depth":75,"height":10,"rotation":0,"pointUsage":"shower"},{"pointId":"point-3","kind":"floor_drain","label":"floor_drain","position":{"x":1283,"y":299},"width":75,"depth":75,"height":10,"rotation":0,"pointUsage":"general"},{"pointId":"point-4","kind":"drain","label":"马桶排水","position":{"x":3596,"y":1455},"width":110,"depth":110,"height":10,"rotation":0,"pointUsage":"toilet"},{"pointId":"toilet-for-point-4","kind":"toilet","label":"马桶","position":{"x":3596,"y":1455},"width":380,"depth":700,"height":760,"rotation":180}],"heights":{"roomHeight":2200,"groundElevation":0,"wallHeight":2200,"netHeight":2200}}